<?xml version="1.0" encoding="UTF-8"?>
<xs:schema xmlns:xs="http://www.w3.org/2001/XMLSchema">

    <!-- Определение элемента book -->
    <xs:complexType name="bookType">
        <xs:sequence>
            <xs:element name="title" type="xs:string"/>
            <xs:element name="author" type="xs:string"/>
            <xs:element name="year" type="xs:integer"/>
            <xs:element name="price" type="xs:decimal"/>
            <xs:element name="category" type="xs:string"/>
        </xs:sequence>
        <xs:attribute name="id" type="xs:integer" use="required"/>
        <xs:attribute name="totalCount" type="xs:integer" use="required"/>
        <xs:attribute name="availableCount" type="xs:integer" use="required"/>
    </xs:complexType>

    <!-- Определение корневого элемента library -->
    <xs:element name="library">
        <xs:complexType>
            <xs:sequence>
                <xs:element name="book" type="bookType" maxOccurs="unbounded"/>
            </xs:sequence>
        </xs:complexType>
    </xs:element>

</xs:schema>